{
  "$schema": "../../../../contracts/schemas/streaming-case-v1.schema.json",
  "case_version": 1,
  "id": "streaming/stable-to-final",
  "description": "finish() finalizes open stable records per finalize_on_close policy.",
  "source": "pi",
  "group_id": "stream-stable-to-final",
  "required_capabilities": [
    "stream-core",
    "stream-apply-append",
    "stream-provisional-records",
    "stream-full-snapshot",
    "stream-record-delta",
    "stream-cursor-v1",
    "stream-file-jsonl"
  ],
  "options": {
    "delivery": "both",
    "include_provisional": true,
    "require_complete_lines": true,
    "finalize_on_close": true,
    "reorder": "reject",
    "reset_policy": "return-reset-required"
  },
  "steps": [
    {
      "id": "append-prefix",
      "input": {
        "kind": "append-bytes",
        "material": "step-prefix.jsonl",
        "source_revision": "gen-0"
      },
      "expected": {
        "update_kind": "updated",
        "complete": false,
        "result": "expected.append-prefix.json"
      },
      "double_invoke": true
    },
    {
      "id": "finish-stream",
      "input": {
        "kind": "finish"
      },
      "expected": {
        "update_kind": "updated",
        "complete": true,
        "result": "expected.finish-stream.json"
      },
      "double_invoke": true
    }
  ],
  "comparison": [
    "stream-json-exact",
    "stream-delta-apply",
    "stream-idempotence"
  ],
  "privacy": {
    "forbidden_substrings": [
      "SECRET_TOKEN_xyz",
      "/Users/real-user/",
      "sk-live-",
      "auth.json"
    ]
  }
}
