{
  "$schema": "../../../../contracts/schemas/streaming-case-v1.schema.json",
  "case_version": 1,
  "id": "streaming/delta-ordering",
  "description": "Multi-step growth produces ordered delta ops that reconstruct each snapshot.",
  "source": "pi",
  "group_id": "stream-delta-ordering",
  "required_capabilities": [
    "stream-core",
    "stream-apply-append",
    "stream-full-snapshot",
    "stream-record-delta",
    "stream-cursor-v1",
    "stream-file-jsonl"
  ],
  "options": {
    "delivery": "both",
    "include_provisional": true,
    "require_complete_lines": true,
    "finalize_on_close": true,
    "reorder": "reject",
    "reset_policy": "return-reset-required"
  },
  "steps": [
    {
      "id": "append-1",
      "input": {
        "kind": "append-bytes",
        "material": "step-1.jsonl",
        "source_revision": "gen-0"
      },
      "expected": {
        "update_kind": "updated",
        "complete": false,
        "result": "expected.append-1.json"
      },
      "double_invoke": true
    },
    {
      "id": "append-2",
      "input": {
        "kind": "append-bytes",
        "material": "step-2.jsonl",
        "source_revision": "gen-0"
      },
      "expected": {
        "update_kind": "updated",
        "complete": false,
        "result": "expected.append-2.json"
      },
      "double_invoke": true
    },
    {
      "id": "append-3",
      "input": {
        "kind": "append-bytes",
        "material": "step-3.jsonl",
        "source_revision": "gen-0"
      },
      "expected": {
        "update_kind": "updated",
        "complete": false,
        "result": "expected.append-3.json"
      },
      "double_invoke": true
    }
  ],
  "comparison": [
    "stream-json-exact",
    "stream-delta-apply",
    "stream-idempotence",
    "stream-oracle-parity"
  ],
  "privacy": {
    "forbidden_substrings": [
      "SECRET_TOKEN_xyz",
      "/Users/real-user/",
      "sk-live-",
      "auth.json"
    ]
  },
  "oracle": {
    "append_equals_prefix": true,
    "prefix_re_normalize": true
  }
}
